{
  "agent_name": "synthesizer",
  "body": {
    "agreement_areas": [
      "Persistence layer boundary is well-defined.",
      "Three worked-example fixtures per output type satisfies XXVIII C6."
    ],
    "disputes": [
      {
        "id": "D1",
        "positions": [
          {
            "agent": "pragmatist",
            "stance": "Budget measurement can defer to F2c."
          },
          {
            "agent": "devils-advocate",
            "stance": "Budget MUST be measured before F2c lock-in."
          }
        ],
        "severity": "trivial",
        "synthesizer_assessment": "Devils-advocate position is structurally correct; budget gate must precede architectural commitment per spec \u00a7 5.1.1.",
        "topic": "Validator budget measurement timing"
      }
    ],
    "emergent_patterns": [
      "F2 split sequencing surfaces dependency violations earlier than monolithic PR review would."
    ],
    "recommendation_to_arbiter": "Adopt devils-advocate position on D1: move budget measurement gate to before F2c commits."
  },
  "deliberation_id": "fixture-conformant-synthesis",
  "deliberation_stage": "originating",
  "engine_version": "0.7.3",
  "output_type": "synthesis",
  "schema_version": "1.0.0-rc.1",
  "source_commit": "abcd1234",
  "timestamp": "2026-05-13T12:04:00Z"
}
